{
  "schema_version": "1.0",
  "kind": "body",
  "id": "arm_forward_r",
  "skeleton_family": "ue5_humanoid",
  "description": "Right arm extended forward at shoulder height, palm facing left; left arm hanging.",
  "joints": {
    "lowerarm_l": {
      "flexion": 10.0
    },
    "lowerarm_r": {
      "flexion": 3.0
    },
    "upperarm_l": {
      "abduction": 6.0
    },
    "upperarm_r": {
      "abduction": 4.0,
      "flexion": 88.0
    }
  }
}
