{
  "schema_version": "1.0",
  "kind": "body",
  "id": "arm_vertical_l",
  "skeleton_family": "ue5_humanoid",
  "description": "Left arm raised straight up, palm forward; right arm hanging.",
  "joints": {
    "lowerarm_l": {
      "flexion": 3.0
    },
    "lowerarm_r": {
      "flexion": 10.0
    },
    "upperarm_l": {
      "flexion": 172.0,
      "twist": 80.0
    },
    "upperarm_r": {
      "abduction": 6.0
    }
  }
}
