{
  "schema_version": "1.0",
  "kind": "body",
  "id": "stop_handup_l",
  "skeleton_family": "ue5_humanoid",
  "description": "Tay tr\u00e1i dang ngang b\u1eb1ng vai, b\u00e0n tay b\u1ebb l\u00ean, l\u00f2ng b\u00e0n tay h\u01b0\u1edbng ra ngo\u00e0i; tay ph\u1ea3i bu\u00f4ng xu\u00f4i.",
  "joints": {
    "hand_l": {
      "deviation": -8.0,
      "flexion": -70.0
    },
    "lowerarm_l": {
      "flexion": 1.2,
      "pronation": 0.1
    },
    "lowerarm_r": {
      "flexion": 10.0
    },
    "upperarm_l": {
      "abduction": 95.5,
      "flexion": 9.1,
      "twist": -6.6
    },
    "upperarm_r": {
      "abduction": 6.0
    }
  }
}
