{
  "schema_version": "1.0",
  "kind": "body",
  "id": "arm_horizontal_l",
  "skeleton_family": "ue5_humanoid",
  "description": "Left arm extended sideways at shoulder height; right arm hanging.",
  "joints": {
    "lowerarm_l": {
      "flexion": 3.0
    },
    "lowerarm_r": {
      "flexion": 10.0
    },
    "upperarm_l": {
      "abduction": 90.0,
      "twist": -60.0
    },
    "upperarm_r": {
      "abduction": 6.0
    }
  }
}
